{
  "schema_version": "2.0.0",
  "persona_id": "example-non-production",
  "display_name": "非生产示例人格（仅用于契约校验）",
  "version": "0.0.0-example",
  "created_at": "2000-01-01T00:00:00Z",
  "package_sha256": "17ded6e69bc62c7196b1e93a4b3713243767de04ab0367fe35e18d358206c55f",
  "files": {
    "paradigm": {
      "path": "paradigm.md",
      "media_type": "text/markdown",
      "encoding": "utf-8",
      "sha256": "0000000000000000000000000000000000000000000000000000000000000000"
    },
    "project": {
      "path": "project.md",
      "media_type": "text/markdown",
      "encoding": "utf-8",
      "sha256": "0000000000000000000000000000000000000000000000000000000000000000"
    },
    "l0": {
      "path": "l0.md",
      "media_type": "text/markdown",
      "encoding": "utf-8",
      "sha256": "0000000000000000000000000000000000000000000000000000000000000000"
    },
    "soul": {
      "path": "soul.md",
      "media_type": "text/markdown",
      "encoding": "utf-8",
      "sha256": "0000000000000000000000000000000000000000000000000000000000000000"
    },
    "l3": {
      "path": "l3.md",
      "media_type": "text/markdown",
      "encoding": "utf-8",
      "sha256": "0000000000000000000000000000000000000000000000000000000000000000"
    },
    "l4": {
      "path": "l4.md",
      "media_type": "text/markdown",
      "encoding": "utf-8",
      "sha256": "0000000000000000000000000000000000000000000000000000000000000000"
    },
    "l5": {
      "path": "l5.md",
      "media_type": "text/markdown",
      "encoding": "utf-8",
      "sha256": "0000000000000000000000000000000000000000000000000000000000000000"
    },
    "l6": {
      "path": "l6.md",
      "media_type": "text/markdown",
      "encoding": "utf-8",
      "sha256": "0000000000000000000000000000000000000000000000000000000000000000"
    }
  }
}
